{
  "company_name": "Acme Labs",
  "job_title": "Backend Engineer",
  "department": "Platform Engineering",
  "job_type": "Full-Time",
  "work_mode": "Hybrid",
  "location": "Bengaluru, Karnataka, India",
  "salary_min": "1200000 INR",
  "salary_max": "1800000 INR",
  "benefits": "Health insurance and learning budget",
  "experience": "Minimum 2 years experience with Python",
  "education": "B.Tech or equivalent",
  "skills": ["Python", "Amazon Web Services", "PostgreSQL", "Docker"],
  "description": "You will build APIs and backend services for our data platform team.",
  "application_deadline": "2026-04-30",
  "posted_date": "2026-03-20",
  "contact_name": "Priya Sharma",
  "contact_whatsapp": "+91 9876543210",
  "contact_email": "hiring@acmelabs.example",
  "apply_link": "https://careers.acmelabs.example/jobs/backend-engineer",
  "custom_note": "",
  "source_url": "https://careers.acmelabs.example/jobs/backend-engineer",
  "raw_text": ""
}
