{
  "company_name": "Redrob AI",
  "job_title": "Software Developer / Intern",
  "department": "",
  "job_type": "Full-Time, Internship",
  "work_mode": "",
  "location": "India",
  "salary_min": "15 LPA",
  "salary_max": "15 LPA",
  "benefits": "Stipend: 1L per month (interns)",
  "experience": "",
  "education": "Graduation Year: 2023 / 2024 / 2025 / 2026 / 2027 / 2028 / 2029",
  "skills": [],
  "description": "Redrob AI is hiring Software Developers and Interns from this hackathon. Graduation Year: 2023 / 2024 / 2025 / 2026 / 2027 / 2028 / 2029. Stipend: 1L per month. Salary: 15 LPA.",
  "application_deadline": "",
  "contact_name": "",
  "contact_whatsapp": "",
  "contact_email": "",
  "apply_link": "https://hack2skill.com/event/india_runs?utm_source=hack2skill&utm_medium=teamdashboard&utm_campaign=india_runs&utm_term=referral-113&utm_content=66ed82b74ec2fa396372a882",
  "custom_note": "Register Now (Free) — hackathon hiring drive",
  "posted_date": "2026-09-05"
}
