{
  "company_name": "Tata Consultancy Services (TCS)",
  "job_title": "Cloud Professional",
  "department": "Cloud / BFSI",
  "job_type": "Walk-in Drive",
  "work_mode": "On-site",
  "location": "Bengaluru, Chennai, Hyderabad, Indore, Mumbai, Pune",
  "salary_min": "",
  "salary_max": "",
  "benefits": "",
  "experience": "Multiple experience ranges",
  "education": "",
  "skills": ["AWS", "Google Cloud Platform", "GCP", "Azure", "GenAI", "ML", "AI"],
  "description": "TCS Mega Walk-In Hiring Drive for Cloud Professionals across Bengaluru, Chennai, Hyderabad, Indore, Mumbai, and Pune. Walk-in on 1st Aug 2026 (Saturday) from 9:30 AM to 1:00 PM. Documents required: Updated Resume, Government ID Proof Xerox (Aadhaar/PAN Card), 2 Passport-Size Photos.",
  "application_deadline": "2026-08-01",
  "contact_name": "",
  "contact_whatsapp": "",
  "contact_email": "",
  "apply_link": "https://on.tcs.com/4lkkCkX",
  "custom_note": "Mega Walk-In Drive — carry resume, ID proof, and 2 passport photos",
  "posted_date": "2026-08-01"
}
