{
  "company_name": "TCS (Tata Consultancy Services)",
  "job_title": "National Qualifier Test (NQT)",
  "department": "",
  "job_type": "Full-Time",
  "work_mode": "",
  "location": "India",
  "salary_min": "",
  "salary_max": "",
  "benefits": "",
  "experience": "Up to 2 years (working professionals)",
  "education": "Pre-final or final year students of any stream or degree; passing years 2022-2028",
  "skills": [],
  "description": "TCS National Qualifier Test (NQT) — eligibility: Pre-final or final year students of any stream or degree; students passing between 2022-2028 looking for a job; working professionals with up to 2 years of experience.",
  "application_deadline": "",
  "contact_name": "",
  "contact_whatsapp": "",
  "contact_email": "",
  "apply_link": "https://www.tcsion.com/hub/national-qualifier-test/",
  "custom_note": "TCS iON National Qualifier Test",
  "posted_date": "2026-09-10"
}
